{
  "schema_version": 1,
  "event_id": "84f4d0dd-1317-4f18-ad21-c3ab975b2f30",
  "commitment_id": "a5b36c91-352b-42cc-9c6a-f6ffdf12107e",
  "action": "TIGHTEN",
  "target_type": "PACKAGE",
  "target_value": "com.histopgambling.fixture.luckymirror",
  "classification": "DEMO_GAMBLING_APP",
  "confidence": 0.98,
  "reason_code": "FIXTURE_MATCH",
  "reason": "The package metadata matches the harmless betting-demo fixture."
}

